{
  "id": "ss-05-q302",
  "version": "0.1.1",
  "status": "draft",
  "themes": [
    "ss-05"
  ],
  "epigraph": "Tema 5. Gestión recaudatoria en periodo voluntario",
  "competency": "Identificar la función de la reclamación de deuda.",
  "difficulty": "medium",
  "prompt": "¿Qué finalidad tiene una reclamación de deuda de la Tesorería?",
  "options": [
    {
      "text": "Reconocer una pensión de jubilación.",
      "isCorrect": false,
      "feedback": "Esta alternativa no resuelve correctamente el hecho descrito. Revisa TRLGSS, artículos 33 y 34.",
      "errorType": "confusion-conceptos",
      "reviewTarget": "Tema 5. Gestión recaudatoria en periodo voluntario: Identificar la función de la reclamación de deuda."
    },
    {
      "text": "Determinar y exigir el importe pendiente con la información y los plazos previstos.",
      "isCorrect": true,
      "feedback": "La reclamación es un acto recaudatorio dirigido a hacer efectiva una deuda, no un reconocimiento de prestación ni una sanción penal."
    },
    {
      "text": "Imponer por sí sola una pena penal.",
      "isCorrect": false,
      "feedback": "Esta alternativa no resuelve correctamente el hecho descrito. Revisa TRLGSS, artículos 33 y 34.",
      "errorType": "confusion-plazos",
      "reviewTarget": "Tema 5. Gestión recaudatoria en periodo voluntario: Identificar la función de la reclamación de deuda."
    },
    {
      "text": "Sustituir la inscripción de la empresa.",
      "isCorrect": false,
      "feedback": "Esta alternativa no resuelve correctamente el hecho descrito. Revisa TRLGSS, artículos 33 y 34.",
      "errorType": "confusion-sujetos",
      "reviewTarget": "Tema 5. Gestión recaudatoria en periodo voluntario: Identificar la función de la reclamación de deuda."
    }
  ],
  "normativeClaimIds": [
    "clm-ss-05-102"
  ],
  "sources": [
    {
      "url": "https://www.boe.es/buscar/act.php?id=BOE-A-2004-15221",
      "location": "TRLGSS, artículos 33 y 34",
      "consultedAt": "2026-07-30"
    }
  ],
  "validFrom": "2026-07-30",
  "validTo": null,
  "legislationCutoffAt": "2026-07-30",
  "visibility": "practice",
  "academicReviewStatus": "pending",
  "legalReviewStatus": "pending",
  "nextReviewAt": "2026-08-30",
  "provenance": {
    "createdBy": "codex-assisted-practical-draft",
    "createdAt": "2026-07-30",
    "changeLog": [
      {
        "version": "0.1.0",
        "date": "2026-07-30",
        "changedBy": "codex-assisted-practical-draft",
        "summary": "Borrador inicial de MC04, pregunta conectada al caso."
      },
      {
        "version": "0.1.1",
        "date": "2026-07-30",
        "changedBy": "codex-assisted-editorial-draft",
        "summary": "Reordenación determinista de opciones; respuesta correcta en posición 2."
      }
    ]
  }
}
