{
  "id": "ss-07-q413",
  "version": "0.1.1",
  "status": "draft",
  "themes": [
    "ss-07"
  ],
  "epigraph": "CP02 — decisión 13",
  "competency": "Separar la deuda empresarial de la acciÃ³n protectora",
  "difficulty": "high",
  "prompt": "Â¿CÃ³mo debe analizarse la solicitud de prestaciÃ³n de la persona trabajadora?",
  "options": [
    {
      "text": "Aplicar la regla contraria sin comprobar separar la deuda empresarial de la acciã³n protectora.",
      "isCorrect": false,
      "feedback": "Esta alternativa no aplica correctamente el supuesto. Revisar TRLGSS, artÃ­culos 165 y 166.",
      "errorType": "confusion-conceptos",
      "reviewTarget": "CP02: Separar la deuda empresarial de la acciÃ³n protectora"
    },
    {
      "text": "Resolver el punto solo con la fecha del caso y sin consultar la norma aplicable.",
      "isCorrect": false,
      "feedback": "Esta alternativa no aplica correctamente el supuesto. Revisar TRLGSS, artÃ­culos 165 y 166.",
      "errorType": "confusion-plazos",
      "reviewTarget": "CP02: Separar la deuda empresarial de la acciÃ³n protectora"
    },
    {
      "text": "Con los requisitos de la contingencia y de la prestaciÃ³n, sin convertir la deuda empresarial en una respuesta automÃ¡tica.",
      "isCorrect": true,
      "feedback": "Respuesta propuesta: Con los requisitos de la contingencia y de la prestaciÃ³n, sin convertir la deuda empresarial en una respuesta automÃ¡tica."
    },
    {
      "text": "Trasladar la decisiÃ³n a otra prestaciÃ³n, sujeto u Ã³rgano sin justificaciÃ³n legal.",
      "isCorrect": false,
      "feedback": "Esta alternativa no aplica correctamente el supuesto. Revisar TRLGSS, artÃ­culos 165 y 166.",
      "errorType": "confusion-sujetos",
      "reviewTarget": "CP02: Separar la deuda empresarial de la acciÃ³n protectora"
    }
  ],
  "normativeClaimIds": [
    "clm-ss-07-413"
  ],
  "sources": [
    {
      "url": "https://www.boe.es/buscar/act.php?id=BOE-A-2015-11724",
      "location": "TRLGSS, artÃ­culos 165 y 166",
      "consultedAt": "2026-07-30"
    }
  ],
  "validFrom": "2026-07-30",
  "validTo": null,
  "legislationCutoffAt": "2026-07-30",
  "visibility": "assessment-only",
  "academicReviewStatus": "pending",
  "legalReviewStatus": "pending",
  "nextReviewAt": "2026-08-30",
  "provenance": {
    "createdBy": "codex-assisted-full-case-draft",
    "createdAt": "2026-07-30",
    "changeLog": [
      {
        "version": "0.1.0",
        "date": "2026-07-30",
        "changedBy": "codex-assisted-full-case-draft",
        "summary": "Borrador de CP02, decisiÃ³n conectada al supuesto."
      },
      {
        "version": "0.1.1",
        "date": "2026-07-30",
        "changedBy": "codex-assisted-editorial-draft",
        "summary": "Reordenación determinista de opciones; respuesta correcta en posición 3."
      }
    ]
  }
}
