{
  "id": "ss-12-q003",
  "version": "0.1.1",
  "status": "draft",
  "themes": [
    "ss-12"
  ],
  "epigraph": "Unidad",
  "competency": "Aplicar unidad de convivencia",
  "difficulty": "medium",
  "prompt": "Una solicitud de IMV incluye varias personas que viven juntas. ¿Qué debe comprobarse?",
  "options": [
    {
      "text": "Sumar siempre a todas las personas empadronadas sin excepción.",
      "isCorrect": false,
      "feedback": "Incorrecto. Deben aplicarse la definición y excepciones legales.",
      "errorType": "excepcion-ignorada",
      "reviewTarget": "S12, unidad"
    },
    {
      "text": "Excluir siempre a las personas menores.",
      "isCorrect": false,
      "feedback": "Incorrecto. La composición de la unidad tiene reglas propias.",
      "errorType": "distractor-absoluto",
      "reviewTarget": "S12, unidad"
    },
    {
      "text": "Considerar solo a quien presenta la solicitud, nunca al resto.",
      "isCorrect": false,
      "feedback": "Incorrecto. La cuantía y vulnerabilidad dependen de la unidad.",
      "errorType": "confusion-sujetos",
      "reviewTarget": "S12, unidad"
    },
    {
      "text": "Si forman una unidad de convivencia conforme a la definición legal y pueden acreditarla.",
      "isCorrect": true,
      "feedback": "Correcto. La convivencia material no basta sin aplicar la categoría legal."
    }
  ],
  "normativeClaimIds": [
    "clm-ss-12-006",
    "clm-ss-12-007"
  ],
  "sources": [
    {
      "url": "https://www.boe.es/buscar/act.php?id=BOE-A-2021-21007",
      "location": "art. 6 Ley 19/2021",
      "consultedAt": "2026-07-30"
    }
  ],
  "validFrom": "2026-07-30",
  "validTo": null,
  "legislationCutoffAt": "2026-07-30",
  "visibility": "practice",
  "academicReviewStatus": "pending",
  "legalReviewStatus": "pending",
  "nextReviewAt": "2026-10-30",
  "provenance": {
    "createdBy": "codex-assisted-editorial-draft",
    "createdAt": "2026-07-30",
    "changeLog": [
      {
        "version": "0.1.0",
        "date": "2026-07-30",
        "changedBy": "codex-assisted-editorial-draft",
        "summary": "Borrador inicial de pregunta ss-12-q003."
      },
      {
        "version": "0.1.1",
        "date": "2026-07-30",
        "changedBy": "codex-assisted-editorial-draft",
        "summary": "Reordenación determinista de opciones; respuesta correcta en posición 4."
      }
    ]
  }
}
