{
  "id": "ss-12-q611",
  "version": "0.1.1",
  "status": "draft",
  "themes": [
    "ss-12"
  ],
  "epigraph": "CP04 — decisión 11",
  "competency": "Aplicar la obligaciÃ³n de comunicar cambios",
  "difficulty": "high",
  "prompt": "Â¿QuÃ© debe hacer la unidad cuando cambia la convivencia o aumentan sus ingresos?",
  "options": [
    {
      "text": "Aplicar la regla contraria sin comprobar aplicar la obligaciã³n de comunicar cambios.",
      "isCorrect": false,
      "feedback": "Esta alternativa no aplica correctamente el supuesto. Revisar Ley 19/2021, artÃ­culos 17 y 19.",
      "errorType": "confusion-conceptos",
      "reviewTarget": "CP04: Aplicar la obligaciÃ³n de comunicar cambios"
    },
    {
      "text": "Resolver el punto solo con la fecha del caso y sin consultar la norma aplicable.",
      "isCorrect": false,
      "feedback": "Esta alternativa no aplica correctamente el supuesto. Revisar Ley 19/2021, artÃ­culos 17 y 19.",
      "errorType": "confusion-plazos",
      "reviewTarget": "CP04: Aplicar la obligaciÃ³n de comunicar cambios"
    },
    {
      "text": "Trasladar la decisiÃ³n a otra prestaciÃ³n, sujeto u Ã³rgano sin justificaciÃ³n legal.",
      "isCorrect": false,
      "feedback": "Esta alternativa no aplica correctamente el supuesto. Revisar Ley 19/2021, artÃ­culos 17 y 19.",
      "errorType": "confusion-sujetos",
      "reviewTarget": "CP04: Aplicar la obligaciÃ³n de comunicar cambios"
    },
    {
      "text": "Comunicar la variaciÃ³n relevante y aportar la informaciÃ³n que permita revisar el derecho.",
      "isCorrect": true,
      "feedback": "Respuesta propuesta: Comunicar la variaciÃ³n relevante y aportar la informaciÃ³n que permita revisar el derecho."
    }
  ],
  "normativeClaimIds": [
    "clm-ss-12-611"
  ],
  "sources": [
    {
      "url": "https://www.boe.es/buscar/act.php?id=BOE-A-2021-21007",
      "location": "Ley 19/2021, artÃ­culos 17 y 19",
      "consultedAt": "2026-07-30"
    }
  ],
  "validFrom": "2026-07-30",
  "validTo": null,
  "legislationCutoffAt": "2026-07-30",
  "visibility": "assessment-only",
  "academicReviewStatus": "pending",
  "legalReviewStatus": "pending",
  "nextReviewAt": "2026-08-30",
  "provenance": {
    "createdBy": "codex-assisted-full-case-draft",
    "createdAt": "2026-07-30",
    "changeLog": [
      {
        "version": "0.1.0",
        "date": "2026-07-30",
        "changedBy": "codex-assisted-full-case-draft",
        "summary": "Borrador de CP04, decisiÃ³n conectada al supuesto."
      },
      {
        "version": "0.1.1",
        "date": "2026-07-30",
        "changedBy": "codex-assisted-editorial-draft",
        "summary": "Reordenación determinista de opciones; respuesta correcta en posición 4."
      }
    ]
  }
}
